{"modeId":"native","schemaVersion":1,"slides":[{"body":["基于官方公告材料，系统梳理 GPT 5.6 的核心能力、关键更新点与发布时间线，帮助团队快速理解新特性并评估其对现有业务的潜在影响"],"editable":true,"order":0,"outlineSlideId":"01M0KY8878VW7DAX4Q5ZPVTWCZ","role":"cover","schemaVersion":1,"slideId":"01M0KZ2JRMZHFH5CG2RQTBRDC4","title":"GPT 5.6 官方公告解读"},{"body":["在有限预览之后，我们正式全面推出 GPT\\-5.6 模型家族：全新旗舰模型 Sol、适合日常工作的均衡型模型 Terra，以及成本效率最高的模型 Luna。"],"editable":true,"order":1,"outlineSlideId":"01M0KY8878VW7DAX4Q5ZPVTWD0","role":"content","schemaVersion":1,"slideId":"01M0KZ2JRMZHFH5CG2RQTBRDC5","title":"公告概览与解读框架"},{"body":["发布日期：2026 年 7 月 9 日","2026 年 7 月 30 日更新：OpenAI 将 GPT\\-5.6 Luna 的价格下调 80%，将 GPT\\-5.6 Terra 的价格下调 20%。","个人成员须在 9 月 1 日前启用采用硬件支持通行密钥的高级账户安全功能，才能继续使用网络安全能力最强的前沿模型"],"editable":true,"order":2,"outlineSlideId":"01M0KY8878VW7DAX4Q5ZPVTWD1","role":"timeline","schemaVersion":1,"slideId":"01M0KZ2JRMZHFH5CG2RQTBRDC6","title":"发布时间线与版本节奏"},{"body":["Responses API 中，程序化工具调用让 GPT\\-5.6 能在内存中编写并运行程序，以协调工具、处理中间结果，并兼容零数据保留（ZDR）。"],"editable":true,"order":3,"outlineSlideId":"01M0KY8878VW7DAX4Q5ZPVTWD2","role":"content","schemaVersion":1,"slideId":"01M0KZ2JRMZHFH5CG2RQTBRDC7","title":"核心能力解析"},{"body":["对比结论直接来自已批准来源，未执行外部研究。"],"editable":true,"order":4,"outlineSlideId":"01M0KY8878VW7DAX4Q5ZPVTWD3","role":"data","schemaVersion":1,"slideId":"01M0KZ2JRMZHFH5CG2RQTBRDC8","title":"Terminal-Bench 2.1 中，Sol Ultra 达到 91.9%，领先 Sol 3%"},{"body":["GPT\\-5.6 Sol 为智能与效率树立了新标准：它在编码、知识工作、网络安全和科学领域取得最先进的成绩，同时以更少的 token、更低的预估成本超越此前及其他前沿模型。"],"editable":true,"order":5,"outlineSlideId":"01M0KY8878VW7DAX4Q5ZPVTWD4","role":"comparison","schemaVersion":1,"slideId":"01M0KZ2JRMZHFH5CG2RQTBRDC9","title":"与前代及同类模型对比"},{"body":["2026 年 7 月 30 日更新：OpenAI 将 GPT\\-5.6 Luna 的价格下调 80%，将 GPT\\-5.6 Terra 的价格下调 20%。"],"editable":true,"order":6,"outlineSlideId":"01M0KY8878VW7DAX4Q5ZPVTWD5","role":"content","schemaVersion":1,"slideId":"01M0KZ2JRMZHFH5CG2RQTBRDCA","title":"定价、可用性与接入方式"},{"body":["随着模型能力不断增强，安全工作仍将继续：新的薄弱点与绕过现有防护的新越狱方式都会被发现，每一代新模型也可能带来新的攻击和滥用途径。"],"editable":true,"order":7,"outlineSlideId":"01M0KY8878VW7DAX4Q5ZPVTWD6","role":"risk_action","schemaVersion":1,"slideId":"01M0KZ2JRMZHFH5CG2RQTBRDCB","title":"对现有业务的潜在影响"},{"body":["全面开放前，我们进行了迄今最密集的安全评估，包括大规模红队测试、与外部专家合作开展的严格能力与防护测试，以及约 70 万个 NVIDIA A100 Tensor Core GPU 等效小时的黑盒自动化红队测试。"],"editable":true,"order":8,"outlineSlideId":"01M0KY8878VW7DAX4Q5ZPVTWD7","role":"risk_action","schemaVersion":1,"slideId":"01M0KZ2JRMZHFH5CG2RQTBRDCC","title":"评估建议与后续行动"},{"body":["结论：GPT\\-5.6 能编写并运行轻量程序，用于协调工具、处理中间结果、监控进度，并随着工作推进选择下一步行动。","行动：基于官方公告材料，系统梳理 GPT 5.6 的核心能力、关键更新点与发布时间线，帮助团队快速理解新特性并评估其对现有业务的潜在影响"],"editable":true,"order":9,"outlineSlideId":"01M0KY8878VW7DAX4Q5ZPVTWD8","role":"ending","schemaVersion":1,"slideId":"01M0KZ2JRMZHFH5CG2RQTBRDCD","title":"总结与讨论"}],"snapshotId":"01M0KZ2JRMZHFH5CG2RQTBRDC3","templateBinding":{"compatibilityVersion":"ppt-master@v4.7.0","roleBindings":{"comparison":"free-design-comparison","content":"free-design-content","cover":"free-design-cover","data":"free-design-data","ending":"free-design-ending","risk_action":"free-design-risk_action","timeline":"free-design-timeline"},"schemaVersion":1,"templateId":"01HTMERN02GDZ5Y11PVPDS06BY","templateVersionId":"01HTMERN02GDZ5Y11PVPDS06BY"},"title":"GPT 5.6 官方公告解读"}